{
  "suite_version": "1.1.0",
  "suite_revision": "sha256:b705d22fe72f0ac9393f19d071f0deba6fe0c78009d9d2625309e8e9ddb8c964",
  "skill_revision": "sha256:1d982166ffd1151dfab36c64b1e41ee0466d6daf424679b47f02885ef7923999",
  "executed_at": "2026-08-28T15:12:11.926706Z",
  "verified_at": "2026-08-28T15:19:47.179021Z",
  "environment": {
    "host": "codex",
    "forward_runner": "Codex CLI isolated batch runner with fresh sessions and direct public-final capture",
    "failure_injection": "simulated"
  },
  "cases": [
    {
      "case_id": "ideate-pure-product",
      "execution": "forward",
      "status": "pass",
      "artifact_path": "artifacts/meeting-core-1d98-b705-ideate-pure-product.json",
      "artifact_sha256": "sha256:15c4222fbc2791646677bf58065cb1b7386353a8eb6a2ca12bd29e705c2987b4",
      "run_id": "codex-batch-3868850e0db1435097b34ac089c0b4f1",
      "assertions": [
        {
          "assertion": "generates complete roles and waits for confirmation before execution",
          "status": "pass",
          "evidence": "The first public turn presents five fully specified roles, says planned coverage is complete, and explicitly asks the user to accept or edit the slate before execution; the synthesis appears only in the follow-up turn."
        },
        {
          "assertion": "selects lenses from distinct value and risk surfaces",
          "status": "pass",
          "evidence": "The slate separates patient access, clinic operations, clinical quality, product strategy, and health IT/privacy, with distinct ownership and exclusions for each lens."
        },
        {
          "assertion": "keeps multiple differentiated framings",
          "status": "pass",
          "evidence": "The synthesis preserves nine materially different opportunity framings, including reminders, barrier resolution, visit readiness, flexible attendance, capacity recovery, continuity recovery, risk-guided outreach, and commitment experiments, and explicitly selects no winner."
        },
        {
          "assertion": "does not use severity or a GO gate",
          "status": "pass",
          "evidence": "The ideation output uses hypotheses, guardrails, risks, and experiments without severity labels or any GO/NO-GO readiness gate."
        },
        {
          "assertion": "includes small experiments",
          "status": "pass",
          "evidence": "Every opportunity includes a bounded test or pilot and observable measures, such as testing preferred reminders, one visit type, fill speed, silent score validation, or voluntary pledges."
        },
        {
          "assertion": "does not paste raw reports",
          "status": "pass",
          "evidence": "The final public turn is a concise integrated opportunity synthesis with an evidence ledger and receipt; it does not include panelist report transcripts."
        }
      ],
      "notes": "Fresh blind public-output grading passed all 6 assertions for the final isolated batch."
    },
    {
      "case_id": "design-cross-module",
      "execution": "forward",
      "status": "pass",
      "artifact_path": "artifacts/meeting-core-1d98-b705-design-cross-module.json",
      "artifact_sha256": "sha256:b771d4b6cbc4c8c3d5955e65a316bcde7556015e9b999327f85d63e00f8c0a5a",
      "run_id": "codex-batch-b9c9d0bb404949cd813e122fb46331ec",
      "assertions": [
        {
          "assertion": "generates complete roles and waits for confirmation before execution",
          "status": "pass",
          "evidence": "The first public turn defines six complete roles, maps all seven risk surfaces, states awaiting_role_review and that no panelist has started, and requests an explicit confirm_and_start response."
        },
        {
          "assertion": "uses distinct architecture, consumer, and operations/risk lenses where material",
          "status": "pass",
          "evidence": "The slate independently covers Order API/client contracts, inventory integrity, payment state, fulfillment messaging, migration/reliability, and incident operations; the synthesis retains consumer compatibility and operations controls alongside architecture."
        },
        {
          "assertion": "does not expand into a big-bang rewrite",
          "status": "pass",
          "evidence": "The proposed migration is explicitly incremental, beginning with instrumentation and moving bounded cohorts through shadow and cutover stages; it rejects unsafe big-bang cutover and permanent dual-write."
        },
        {
          "assertion": "covers idempotency and ownership",
          "status": "pass",
          "evidence": "The design assigns sole-writer ownership across Order, Inventory, Payment, Fulfillment, and Operations, and specifies API idempotency keys, command/event identities, outboxes, inboxes, deduplication, and replay behavior."
        },
        {
          "assertion": "keeps design separate from implementation",
          "status": "pass",
          "evidence": "The role constraints and output stay at responsibilities, contracts, states, migration design, trade-offs, and genuine decision gates; they explicitly place runtime implementation and implementation-plan details out of scope."
        }
      ],
      "notes": "Fresh blind public-output grading passed all 5 assertions for the final isolated batch."
    },
    {
      "case_id": "converge-options",
      "execution": "forward",
      "status": "pass",
      "artifact_path": "artifacts/meeting-core-1d98-b705-converge-options.json",
      "artifact_sha256": "sha256:685adf40a745c5fe8d8d458c665fed4e8d49028af6c92c734af83fbbdcb4a47f",
      "run_id": "codex-batch-1463d793f9c0447399b46e5351fc2a88",
      "assertions": [
        {
          "assertion": "generates complete roles and waits for confirmation before execution",
          "status": "pass",
          "evidence": "The first public turn supplies three complete roles with ownership, exclusions, evidence, deliverables, and risk coverage, states awaiting_role_review with no panelist executed, and asks for confirm_and_start."
        },
        {
          "assertion": "adjudicates rather than votes",
          "status": "pass",
          "evidence": "The final decision adopts the transactional outbox by comparing each supplied option against correctness, compatibility, rollback/operability, and cost, with no vote count used."
        },
        {
          "assertion": "does not invent options unless constraints require it",
          "status": "pass",
          "evidence": "The output evaluates exactly the three supplied architectures and chooses Option 2; transitional shadowing and fallback controls are rollout safeguards rather than a newly invented target architecture."
        },
        {
          "assertion": "gives reasons for rejected options",
          "status": "pass",
          "evidence": "It rejects synchronous calls for cross-system atomicity, timeout, response-coupling, and recovery weaknesses, and rejects polling for cursor ambiguity, storage coupling, lag, load, and recovery problems."
        },
        {
          "assertion": "returns a next action",
          "status": "pass",
          "evidence": "It provides a two-release execution sequence, mandatory implementation contracts, explicit cutover gates, monitoring requirements, and a continue gate."
        }
      ],
      "notes": "Fresh blind public-output grading passed all 5 assertions for the final isolated batch."
    },
    {
      "case_id": "review-preimplementation-readiness",
      "execution": "forward",
      "status": "pass",
      "artifact_path": "artifacts/meeting-core-1d98-b705-review-preimplementation-readiness.json",
      "artifact_sha256": "sha256:39741b3c200b69a0c6d9bb73af89bd04bc29e53014b6c1a879d3c04d20cd9c15",
      "run_id": "codex-batch-0141142ca5854f0fa134a17d2380b6fa",
      "assertions": [
        {
          "assertion": "generates complete roles and waits for confirmation before execution",
          "status": "pass",
          "evidence": "The first public turn fully specifies five reviewers, covers all six risk surfaces, states that no panelist has been dispatched and the state is awaiting_role_review, and requires confirm_and_start."
        },
        {
          "assertion": "respects read-only authorization",
          "status": "pass",
          "evidence": "The proposal explicitly prohibits edits, branch changes, stashing, external writes, and implementation, and the completion receipt states that no files, branches, worktree state, or external systems were changed."
        },
        {
          "assertion": "detects compatibility, migration, rollback, and branch/dirty-worktree gates",
          "status": "pass",
          "evidence": "The findings identify unsafe 2.4-million-row migration and missing backfill, API/Mobile compatibility gaps, destructive column-drop rollback, and the main-branch/unrelated-dirty-work barrier."
        },
        {
          "assertion": "does not modify the unrelated change",
          "status": "pass",
          "evidence": "The output calls for an isolated branch-safe workflow that leaves src/Billing/Invoice.php untouched and explicitly reports that no worktree state or files were changed."
        },
        {
          "assertion": "does not issue GO with unresolved high risks",
          "status": "pass",
          "evidence": "The final gate is NO-GO, grounded in multiple blocker and high-severity findings, and it requires a revised plan and fresh verification before GO."
        }
      ],
      "notes": "Fresh blind public-output grading passed all 5 assertions for the final isolated batch."
    },
    {
      "case_id": "design-mobile-api-customer",
      "execution": "forward",
      "status": "pass",
      "artifact_path": "artifacts/meeting-core-1d98-b705-design-mobile-api-customer.json",
      "artifact_sha256": "sha256:4302a3549d45c7beae30444a2475bb8acd7991fea416ba27a3b08db7289ad95c",